{
    "channels": [
        {
            "type": {
                "name": "502"
            },
            "unit": {
                "name": "bar"
            },
            "values": [
                {
                    "additionalData": [
                        {
                            "description": "ND",
                            "name": "valueType"
                        }
                    ],
                    "description": "0,90",
                    "exponent": 2,
                    "timeStamp": "2017-07-26T10:50:17",
                    "value": 0.8960440158843994
                }
            ]
        },
        {
            "type": {
                "name": "501"
            },
            "unit": {
                "name": "bar"
            },
            "values": [
                {
                    "additionalData": [
                        {
                            "description": "HD",
                            "name": "valueType"
                        }
                    ],
                    "description": "1,48",
                    "exponent": 2,
                    "timeStamp": "2017-07-26T10:50:17",
                    "value": 1.4755280017852783
                }
            ]
        },
        {
            "type": {
                "name": ""
            },
            "unit": {
                "name": "°C"
            },
            "values": [
                {
                    "additionalData": [
                        {
                            "description": "to",
                            "name": "valueType"
                        }
                    ],
                    "description": "-3,3",
                    "exponent": 1,
                    "timeStamp": "2017-07-26T10:50:17",
                    "value": -3.379302978515625
                }
            ]
        },
        {
            "type": {
                "name": ""
            },
            "unit": {
                "name": "°C"
            },
            "values": [
                {
                    "additionalData": [
                        {
                            "description": "tc",
                            "name": "valueType"
                        }
                    ],
                    "description": "3,8",
                    "exponent": 1,
                    "timeStamp": "2017-07-26T10:50:17",
                    "value": 3.813812255859375
                }
            ]
        },
        {
            "type": {
                "name": "100"
            },
            "unit": {
                "name": "°C"
            },
            "values": [
                {
                    "additionalData": [
                        {
                            "description": "toh",
                            "name": "valueType"
                        }
                    ],
                    "description": "-24,0",
                    "exponent": 1,
                    "timeStamp": "2017-07-26T10:50:17",
                    "value": -24.0673828125
                }
            ]
        },
        {
            "type": {
                "name": "101"
            },
            "unit": {
                "name": "°C"
            },
            "values": [
                {
                    "additionalData": [
                        {
                            "description": "tcu",
                            "name": "valueType"
                        }
                    ],
                    "description": "-14,1",
                    "exponent": 1,
                    "timeStamp": "2017-07-26T10:50:17",
                    "value": -14.122161865234375
                }
            ]
        },
        {
            "type": {
                "name": ""
            },
            "unit": {
                "name": "K"
            },
            "values": [
                {
                    "additionalData": [
                        {
                            "description": "Δtoh",
                            "name": "valueType"
                        }
                    ],
                    "description": "---",
                    "exponent": 1,
                    "timeStamp": "2017-07-26T10:50:17",
                    "value": 9.80908925027372e-45
                }
            ]
        },
        {
            "type": {
                "name": ""
            },
            "unit": {
                "name": "K"
            },
            "values": [
                {
                    "additionalData": [
                        {
                            "description": "Δtcu",
                            "name": "valueType"
                        }
                    ],
                    "description": "17,9",
                    "exponent": 1,
                    "timeStamp": "2017-07-26T10:50:17",
                    "value": 17.89996337890625
                }
            ]
        }
    ],
    "device": [
        {
            "name": "testo 115i",
            "serial": "13379100"
        },
        {
            "name": "testo 115i",
            "serial": "13379101"
        },
        {
            "name": "testo 549i",
            "serial": "13379502"
        },
        {
            "name": "testo 549i",
            "serial": "13379501"
        }
    ],
    "properties": [
        {
            "description": "refrigerant",
            "name": "refrigerant",
            "values": [
                {
                    "description": "R1234ze",
                    "name": "refrigerantValue",
                    "value": "R1234ze"
                }
            ]
        },
        {
            "description": "pressureType",
            "name": "pressureType",
            "values": [
                {
                    "description": "P<sub>rel</sub>",
                    "name": "pressureTypeValue",
                    "value": "P<sub>rel</sub>"
                }
            ]
        }
    ],
    "schemaVersion": "1.0.2",
    "timeStamp": "2017-07-26T10:50:17",
    "type": {
        "name": "Kälte"
    }
}
